{
  "schemaVersion": 1,
  "gameId": "swsh",
  "name": "Pokémon Sword / Shield",
  "versions": ["sword", "shield"],
  "areas": [
    {
      "id": "route-1",
      "name": "Route 1",
      "unlockAfter": null,
      "tags": ["route", "starter-area"],
      "encounters": [
        { "species": "skwovet", "methods": ["walk"], "rate": 50 },
        { "species": "rookidee", "methods": ["walk"], "rate": 30 },
        { "species": "wooloo", "methods": ["walk"], "rate": 15 },
        { "species": "nickit", "methods": ["walk"], "rate": 5 },
        { "species": "skwovet", "methods": ["grass"], "rate": 40 },
        { "species": "blipbug", "methods": ["grass"], "rate": 30 },
        { "species": "caterpie", "methods": ["grass"], "rate": 15 },
        { "species": "grubbin", "methods": ["grass"], "rate": 10 },
        { "species": "hoothoot", "methods": ["grass"], "rate": 5 }
      ]
    },
    {
      "id": "route-2",
      "name": "Route 2",
      "unlockAfter": null,
      "tags": ["route"],
      "encounters": [
        { "species": "skwovet", "methods": ["walk"], "rate": 38 },
        { "species": "rookidee", "methods": ["walk"], "rate": 30 },
        { "species": "nickit", "methods": ["walk"], "rate": 15 },
        { "species": "chewtle", "methods": ["walk"], "rate": 10 },
        { "species": "yamper", "methods": ["walk"], "rate": 5 },
        { "species": "zigzagoon", "methods": ["walk"], "rate": 2 },
        { "species": "blipbug", "methods": ["grass"], "rate": 40 },
        { "species": "rookidee", "methods": ["grass"], "rate": 25 },
        { "species": "seedot", "methods": ["grass"], "rate": 20, "conditions": { "version": ["sword"] } },
        { "species": "lotad", "methods": ["grass"], "rate": 20, "conditions": { "version": ["shield"] } },
        { "species": "purrloin", "methods": ["grass"], "rate": 10 },
        { "species": "hoothoot", "methods": ["grass"], "rate": 5 },
        { "species": "magikarp", "methods": ["fish"], "rate": 80 },
        { "species": "chewtle", "methods": ["fish"], "rate": 15 },
        { "species": "arrokuda", "methods": ["fish"], "rate": 5 }
      ]
    },
    {
      "id": "route-3",
      "name": "Route 3",
      "unlockAfter": "gym-1-milo",
      "tags": ["route"],
      "encounters": [
        { "species": "zigzagoon", "methods": ["walk"], "rate": 38 },
        { "species": "gossifleur", "methods": ["walk"], "rate": 30 },
        { "species": "vulpix", "methods": ["walk"], "rate": 15, "conditions": { "version": ["sword"] } },
        { "species": "growlithe", "methods": ["walk"], "rate": 15, "conditions": { "version": ["shield"] } },
        { "species": "stunky", "methods": ["walk"], "rate": 10 },
        { "species": "trubbish", "methods": ["walk"], "rate": 5 },
        { "species": "tyrogue", "methods": ["walk"], "rate": 2 },
        { "species": "rookidee", "methods": ["grass"], "rate": 35 },
        { "species": "machop", "methods": ["grass"], "rate": 20 },
        { "species": "pancham", "methods": ["grass"], "rate": 20 },
        { "species": "mudbray", "methods": ["grass"], "rate": 15 },
        { "species": "klink", "methods": ["grass"], "rate": 9 },
        { "species": "sizzlipede", "methods": ["grass"], "rate": 1 },
        { "species": "skwovet", "methods": ["berry-tree"], "rate": 80 },
        { "species": "cherubi", "methods": ["berry-tree"], "rate": 20 }
      ]
    },
    {
      "id": "galar-mine",
      "name": "Galar Mine",
      "unlockAfter": "gym-1-milo",
      "tags": ["cave"],
      "encounters": [
        { "species": "rolycoly", "methods": ["walk"], "rate": 35 },
        { "species": "timburr", "methods": ["walk"], "rate": 25, "conditions": { "version": ["sword"] } },
        { "species": "roggenrola", "methods": ["walk"], "rate": 25, "conditions": { "version": ["shield"] } },
        { "species": "woobat", "methods": ["walk"], "rate": 15 },
        { "species": "diglett", "methods": ["walk"], "rate": 10 },
        { "species": "drilbur", "methods": ["walk"], "rate": 10 },
        { "species": "roggenrola", "methods": ["walk"], "rate": 5, "conditions": { "version": ["sword"] } },
        { "species": "timburr", "methods": ["walk"], "rate": 5, "conditions": { "version": ["shield"] } }
      ]
    },
    {
      "id": "route-4",
      "name": "Route 4",
      "unlockAfter": "gym-1-milo",
      "tags": ["route"],
      "encounters": [
        { "species": "electrike", "methods": ["walk"], "rate": 30 },
        { "species": "meowth-galar", "methods": ["walk"], "rate": 23 },
        { "species": "yamper", "methods": ["walk"], "rate": 20 },
        { "species": "pumpkaboo-average", "methods": ["walk"], "rate": 15 },
        { "species": "pikachu", "methods": ["walk"], "rate": 5, "conditions": { "version": ["sword"] } },
        { "species": "eevee", "methods": ["walk"], "rate": 5, "conditions": { "version": ["shield"] } },
        { "species": "meowth-galar", "methods": ["grass"], "rate": 35 },
        { "species": "wooloo", "methods": ["grass"], "rate": 25 },
        { "species": "milcery", "methods": ["grass"], "rate": 20 },
        { "species": "joltik", "methods": ["grass"], "rate": 10 },
        { "species": "cutiefly", "methods": ["grass"], "rate": 5 },
        { "species": "budew", "methods": ["grass"], "rate": 4 },
        { "species": "ferroseed", "methods": ["grass"], "rate": 1 },
        { "species": "magikarp", "methods": ["fish"], "rate": 70 },
        { "species": "chewtle", "methods": ["fish"], "rate": 20 },
        { "species": "goldeen", "methods": ["fish"], "rate": 10 }
      ]
    },
    {
      "id": "route-5",
      "name": "Route 5",
      "unlockAfter": "gym-2-nessa",
      "tags": ["route"],
      "encounters": [
        { "species": "stufful", "methods": ["walk"], "rate": 35 },
        { "species": "swirlix", "methods": ["walk"], "rate": 30, "conditions": { "version": ["sword"] } },
        { "species": "spritzee", "methods": ["walk"], "rate": 30, "conditions": { "version": ["shield"] } },
        { "species": "minccino", "methods": ["walk"], "rate": 15 },
        { "species": "wobbuffet", "methods": ["walk"], "rate": 10 },
        { "species": "farfetchd", "methods": ["walk"], "rate": 5, "conditions": { "version": ["sword"] } },
        { "species": "drifloon", "methods": ["walk"], "rate": 5 },
        { "species": "dottler", "methods": ["grass"], "rate": 26 },
        { "species": "espurr", "methods": ["grass"], "rate": 20 },
        { "species": "nuzleaf", "methods": ["grass"], "rate": 20, "conditions": { "version": ["sword"] } },
        { "species": "lombre", "methods": ["grass"], "rate": 20, "conditions": { "version": ["shield"] } },
        { "species": "applin", "methods": ["grass"], "rate": 10 },
        { "species": "dewpider", "methods": ["grass"], "rate": 5 },
        { "species": "nincada", "methods": ["grass"], "rate": 5 },
        { "species": "magikarp", "methods": ["fish"], "rate": 70 },
        { "species": "chewtle", "methods": ["fish"], "rate": 20 },
        { "species": "goldeen", "methods": ["fish"], "rate": 10 }
      ]
    },
    {
      "id": "route-6",
      "name": "Route 6",
      "unlockAfter": "gym-3-kabu",
      "tags": ["route"],
      "encounters": [
        { "species": "yamask-galar", "methods": ["walk"], "rate": 35 },
        { "species": "helioptile", "methods": ["walk"], "rate": 29 },
        { "species": "dugtrio", "methods": ["walk"], "rate": 20 },
        { "species": "maractus", "methods": ["walk"], "rate": 10 },
        { "species": "axew", "methods": ["walk"], "rate": 5, "conditions": { "version": ["sword"] } },
        { "species": "trapinch", "methods": ["walk"], "rate": 1, "conditions": { "version": ["shield"] } },
        { "species": "silicobra", "methods": ["grass"], "rate": 30 },
        { "species": "durant", "methods": ["grass"], "rate": 20, "conditions": { "version": ["sword"] } },
        { "species": "heatmor", "methods": ["grass"], "rate": 20, "conditions": { "version": ["shield"] } },
        { "species": "duskull", "methods": ["grass"], "rate": 18 },
        { "species": "skorupi", "methods": ["grass"], "rate": 10 },
        { "species": "hippopotas", "methods": ["grass"], "rate": 10 },
        { "species": "torkoal", "methods": ["grass"], "rate": 5 },
        { "species": "hawlucha", "methods": ["grass"], "rate": 2 },
        { "species": "greedent", "methods": ["berry-tree"], "rate": 100 },
        { "species": "magikarp", "methods": ["fish"], "rate": 70 },
        { "species": "drednaw", "methods": ["fish"], "rate": 20 },
        { "species": "goldeen", "methods": ["fish"], "rate": 10 }
      ]
    },
    {
      "id": "route-7",
      "name": "Route 7",
      "unlockAfter": "gym-4-bea-allister",
      "tags": ["route"],
      "encounters": [
        { "species": "perrserker", "methods": ["walk"], "rate": 30 },
        { "species": "thievul", "methods": ["walk"], "rate": 20 },
        { "species": "galvantula", "methods": ["walk"], "rate": 20 },
        { "species": "liepard", "methods": ["walk"], "rate": 15 },
        { "species": "inkay", "methods": ["walk"], "rate": 10 },
        { "species": "morpeko", "methods": ["walk"], "rate": 5 },
        { "species": "toxel", "methods": ["grass"], "rate": 25 },
        { "species": "karrablast", "methods": ["grass"], "rate": 25, "conditions": { "version": ["sword"] } },
        { "species": "shelmet", "methods": ["grass"], "rate": 25, "conditions": { "version": ["shield"] } },
        { "species": "corviknight", "methods": ["grass"], "rate": 20 },
        { "species": "liepard", "methods": ["grass"], "rate": 10 },
        { "species": "meowstic-male", "methods": ["grass"], "rate": 10 },
        { "species": "seismitoad", "methods": ["grass"], "rate": 5 },
        { "species": "greedent", "methods": ["berry-tree"], "rate": 100 }
      ]
    },
    {
      "id": "glimwood-tangle",
      "name": "Glimwood Tangle",
      "unlockAfter": "gym-4-bea-allister",
      "tags": ["forest", "special"],
      "encounters": [